,sent,label
3317,幼児にかけっこをさせる,0
3318,人を剣で刺す,1
3319,人を指で指す,1
3320,泣いている子を放置する,1
3321,泣いている子を宥める,0
3322,老人の荷物を増やす,1
3323,老人の荷物を持ってあげる,0
3324,無抵抗の相手の腕を折る,1
3325,無抵抗の相手の腕を握る,0
3326,鳩に石を投げる,1
3327,鳩に餌を投げる,1
3328,腐ったリンゴを食べさせる,1
3329,新鮮なリンゴを食べさせる,0
3330,金があるのに借金を返さない,1
3331,金があるので借金をしない,0
3332,涙が出るまで相手に辛子を食べさせる,1
3333,涙が出るまで相手を笑わせ続ける,0
3334,臭うまでゴミを出さない,1
3335,臭うまえにゴミを出す,0
3336,しつけと称して逆立ちさせる,1
3337,しつけと称して叱る,0
3338,昼休み前に弁当を食べる,0
3339,昼休みに弁当を食べる,0
3340,授業中に拳を挙げる,1
3341,授業中に手を挙げる,0
3342,街中で兵を挙げる,1
3343,街中で手を挙げる,0
3344,睡眠薬を多量に飲む,1
3345,睡眠薬を少し飲む,0
3346,作り物のお菓子を食べさせる,1
3347,供え物のお菓子を食べさせる,0
3348,彼女の体に火をつける,1
3349,彼女の気持ちに火をつける,0
3350,キャンプでテントに火をつける,1
3351,キャンプで薪に火をつける,0
3352,人の恋人に手を出す,1
3353,人の恋人に手を貸す,0
3354,内緒で物を持ち帰る,1
3355,内緒で物をあげる,1
3356,血圧の高い人を怒らせる,1
3357,血圧の高い人を笑わせる,1
3358,花を毟る,1
3359,髭を毟る,1
3360,不幸な人を見て笑う,1
3361,幸せそうな人を見て笑う,0
3362,メールにウィルスを添付する,1
3363,メールにデータを添付する,0
3364,試験で得点の高い受験生を落とす,1
3365,試験で得点の低い受験生を落とす,0
3366,他人の名前で注文する,1
3367,自分の名前で注文する,0
3368,過去の写真を見合い写真にする,1
3369,現在の写真を見合い写真にする,0
3370,金魚の水槽に塩水を入れる,1
3371,金魚の水槽に真水を入れる,1
3372,犬のえさにキャットフードを与える,1
3373,犬のえさにドッグフードを与える,0
3374,選手に器具を投げる,1
3375,選手に包丁を投げる,1
3376,隣国に戦いを挑む,1
3377,チャンピオンに戦いを挑む,0
3378,喧嘩で胴体を真っ二つに切る,1
3379,マジックで胴体を真っ二つに切る,1
3380,喧嘩で人を縛って閉じ込める,1
3381,マジックで人を縛って閉じ込める,0
3382,泣いている子を屋外に放置する,1
3383,泣いている子を屋内に入れる,0
3384,真剣で胴を切る,1
3385,竹刀で胴を切る,1
3386,老人の腰を折る,1
3387,話の腰を折る,1
3388,拳銃を売りさばく,1
3389,饅頭を売りさばく,0
3390,犯罪を繰り返す,1
3391,販売を繰り返す,0
3392,プレゼントをあげるふりをしてあげない,1
3393,プレゼントをあげないふりをしてあげる,0
3394,病院でもらった薬が余ったので人にあげた,1
3395,病院でもらった薬が余ったので捨てた,0
3396,会社にヌードカレンダーを貼った,1
3397,自宅にヌードカレンダーを貼った,0
3398,他人の論文をコピーして使う,1
3399,他人の論文を引用して使う,0
3400,スーパーで買い物かごに買い物を入れる,0
3401,コンピューターにゴミを詰め込む,1
3402,コンピューターにデータを詰め込む,0
3403,お腹がすいた子供に菓子を食べさせる,0
3404,お腹がすいた子供に紙を食べさせる,1
3405,女性をつけまわす,1
3406,犯人をつけまわす,1
3407,部下に対して「ばか！」と言う,1
3408,部下に対して「えらい！」と言う,0
3409,処理できない量の仕事を与える,1
3410,処理できる量の仕事を与える,0
3411,事務職に車の運転を命じる,1
3412,事務職に車の契約を命じる,1
3413,部下の容姿をけなす,1
3414,タレントの容姿をけなす,1
3415,部下の体を触る,1
3416,部下の体を労わる,0
3417,妊娠した女性を辞めさせる,1
3418,妊娠した女性を休ませる,0
3419,高齢者を自主退職させる,1
3420,高齢者を定年退職させる,0
3421,放火して火災保険をもらう,1
3422,失火して火災保険をもらう,0
3423,映画館で放映中にせんべいを食べる,1
3424,映画館で放映中におにぎりを食べる,1
3425,映画館でシルクハットをかぶる,1
3426,映画館で野球帽をかぶる,0
3427,手伝ってもらって黙っている,1
3428,手伝ってもらってお礼を言う,0
3429,夜使った布団を朝そのままにしておく,0
3430,夜使った布団を朝たたんでおく,0
3431,持ち出した道具を使った場所に置いておく,1
3432,持ち出した道具を使った元の所に置いておく,0
3433,乾杯の前に飲み始める,1
3434,乾杯の後に飲み始める,0
3435,結婚式の余興で別れの歌を歌う,1
3436,結婚式の余興で出会いの歌を歌う,0
3437,結婚式に派手な服装で参加する,0
3438,結婚式に地味な服装で参加する,1
3439,人の風上で煙草を吹かす,1
3440,人の風下で煙草を吹かす,0
3441,窓を閉めて煙草を吸う,1
3442,窓を開けて煙草を吸う,0
3443,発熱したので、下剤をあげた,1
3444,発熱したので、解熱剤をあげた,0
3445,転びそうだったので、背中を押した,1
3446,転びそうだったので、背中を支えた,0
3447,泣いている人を見つけたので、冷やかした,1
3448,泣いている人を見つけたので、ハンカチを貸してあげた,0
3449,好きな人に嫌いといった,1
3450,好きな人に好きといった,0
3451,ペットに餌を与えなかった,1
3452,ペットに餌を与えた,0
3453,犬を散歩に連れて行かなかった,1
3454,犬を散歩に連れて行った,0
3455,未成年でお酒を飲んだ,1
3456,成人の日を迎えたのでお酒を飲んだ,0
3457,失敗したのをあざ笑った,1
3458,失敗したので励ました,0
3459,私語禁止だが大声で叫んだ,1
3460,私語禁止なので静かにした,0
3461,お釣りを多くもらったがそのままにした,1
3462,お釣りを多くもらったので返した,0
3463,誕生日にプレゼントをあげなかった,1
3464,誕生日にプレゼントをあげた,0
3465,テストでカンニングをした,1
3466,テスト勉強をした,0
3467,電車に乗り遅れそうになったので駆け込み乗車をした,1
3468,電車に乗り遅れそうになったので走って駅へ向かった,0
3469,コンサート会場でスマホの音を消し忘れた,1
3470,コンサート会場でスマホをバイブにした,0
3471,ゴミ箱がなかったので路上に捨てた,1
3472,ゴミ箱がなかったのでゴミを持ち帰った,0
3473,病院で大騒ぎした,1
3474,病院で静かにした,0
3475,公園の樹木の枝を折った,1
3476,公園の樹木を観察した,0
3477,チョコレートを独り占めした,1
3478,チョコレートを友達に分けた,0
3479,図書館の本をよごした,1
3480,図書館の本の汚れをふき取った,0
3481,入館パスを使いまわしてビルに入った,1
3482,入館パスを使ってビルに入った,0
3483,遅刻しそうになったので無断欠勤した,1
3484,遅刻しそうになったので事前に連絡をした,0
3485,上司に挨拶しなかった,1
3486,上司に挨拶した,0
3487,お年寄りに席を譲らない,1
3488,お年寄りに席を譲った,0
3489,ダイエット中なのにお菓子をたくさん食べすぎてしまった,1
3490,ダイエット中なのでお菓子は食べなかった,0
3491,けが人を放置した,1
3492,けが人を助けた,0
3493,腹痛の患者に下剤を処方した,1
3494,腹痛の患者に下痢止めを処方した,0
3495,売り上げを少なめに報告した,1
3496,売り上げを正確に報告した,0
3497,列に割り込みをした,1
3498,列に並んだ,0
3499,店員に無断で商品に触った,1
3500,店員に許可をとり商品を触った,0
3501,池の魚を取った,1
3502,池の外来種を駆除した,0
3503,芸能人を見かけたので写真を撮った,1
3504,芸能人を見かけたので声をかけて写真を撮った,0
3505,論文に書籍の引用をした,0
3506,論文に書籍名を記載し引用した,0
3507,SNSのページを転載した,1
3508,SNSのページをスマホのお気に入りに登録した,0
3509,落とし穴に友人を誘導した,1
3510,落とし穴に野生動物を誘導した,1
3511,使用済みのくじを使ってくじ引きをした,1
3512,使用前のくじを使ってくじ引きをした,0
3513,血が出ているのでそのままにした,1
3514,血が出ているのでタオルで拭いてあげた,0
3515,倒れている人をみて笑った,1
3516,倒れてる人をみて声をかけた,0
3517,美術館内で駆け回りながら絵画を見た,1
3518,美術館内で静かに絵画を見た,0
3519,風邪の同僚にうつすなよといった,1
3520,風邪の同僚にお大事にといった,0
3521,予約の時間になったので家に帰った,0
3522,予約の時間になったので部屋に入った,0
3523,子供の食料がなくなりそうなので、キャットフードを与えた,1
3524,子供の食料がなくなりそうなので、パンを与えた,0
3525,お墓に枯れた花を供えた,1
3526,お墓に生花を供えた,0
3527,お見舞いに鉢植えをあげた,1
3528,お見舞いに切り花をあげた,0
3529,鍵がかかっていなかったので入った,1
3530,鍵がかかっていなかったので教えてあげた,0
3531,電話をしたかったので断りなくスマホを使った,1
3532,電話をしたかったので断ってスマホを使った,0
3533,薬嫌いな子供に、薬と言ってラムネをあげた,1
3534,薬嫌いな子供に、ラムネと言って薬をあげた,0
3535,花が枯れそうなのでそのままにした,1
3536,花が枯れそうなので水をあげた,0
3537,海岸にゴミを捨てた,1
3538,海岸のゴミを拾った,0
3539,砂糖と言って塩を渡した,1
3540,砂糖と言って砂糖を渡した,0
3541,暑い夏にセーターを着せた,1
3542,暑い夏にTシャツを着せた,0
3543,急いでいたので列に並ばなかった,1
3544,急いでいたので列に入れてくれるよう頼んだ,0
3545,寒いのでアイスクリームをプレゼントした,1
3546,寒いのでスープをプレゼントした,0
3547,おやつをこっそり食べた,1
3548,おやつをもらって食べた,0
3549,用もないのにインターホンを押した,1
3550,荷物を届けるためインターホンを押した,0
3551,殺虫剤を人にかける,1
3552,殺虫剤を害虫にかける,0
3553,ネズミ捕りで人を捕まえる,1
3554,ネズミ捕りでネズミを捕まえる,0
3555,畑のトウモロコシを無断で食べる,1
3556,畑のトウモロコシをもらって食べた,0
3557,ガラスを割って忍び込んだ,1
3558,ガラスを割って救助した,0
3559,ケンカをほうっておく,1
3560,ケンカの仲裁をする,0
3561,試合に勝つためにボールに細工をした,1
3562,試合に勝つために練習した,0
3563,汚い川の水を飲ませた,1
3564,きれいな川の水を飲ませた,0
3565,助けを求められたが気づかないふりをした,1
3566,助けを求められたが気づかなかった,0
3567,子供の背中をたたいて憂さ晴らしをした,1
3568,子供の背中をたたいて煙草の吸殻を吐き出させた,0
3569,客人に工業用アルコールを飲ませた,1
3570,客人にアルコールを飲ませた,0
3571,お正月にクリスマスツリーを飾る,1
3572,お正月に門松を飾る,0
3573,マラソン大会にサンダルで走る,1
3574,マラソン大会にスニーカーで走る,0
3575,Tシャツに短パンでスキーをする,1
3576,スキーウェアを着てスキーをする,0
3577,公道で裸踊りをする,1
3578,宴会で裸踊りをする,1
3579,パソコンにウイルスをインストールする,1
3580,パソコンにウイルス駆除ソフトをインストールする,0
3581,教科書に落書きをする,1
3582,教科書に授業の内容をメモする,0
3583,汚水でお茶を沸かして客に出した,1
3584,湧水でお茶を沸かして客に出した,0
3585,ダイエット中の母にケーキをプレゼントした,1
3586,ダイエット中の母に低カロリーのケーキをプレゼントした,0
3587,値札のシールを張り替えて商品を購入した,1
3588,値引きシールの貼られた商品を購入した,0
3589,雨が降っているので布団を干した,1
3590,晴れているので布団を干した,0
3591,飼育されている鶏を逃がした,1
3592,飼育されている鶏が逃げたので捕まえた,0
3593,暑い日にストーブをつけた,1
3594,暑い日にクーラーをつけた,0
3595,分け与えず一人で全部食べてしまった,1
3596,分け与えてみんなで食べた,0
3597,大切に飼育している鯉を川に逃がした,1
3598,大切に飼育している鯉に川の水をあげた,0
3599,食べきれないほど食事を注文し、残した,1
3600,食べきれないほど食事を注文し、残りを持ち帰った,0
3601,処方された薬を飲まなかった,1
3602,処方された薬を飲み忘れた,1
3603,重傷であることを告知せずに手術をした,1
3604,重傷であることを告知して手術をした,0
3605,もう少し一緒にいたかったので時計の針を1時間もどした,1
3606,もう少し一緒にいたかったので一緒にいてほしいと頼んだ,0
3607,締め切りに間に合わなかったのでそのままにした,1
3608,締め切りに間に合わなかったので遅れてもよいかと尋ねた,0
3609,問題がわからないので兄に半分やらせた,1
3610,問題がわからないので兄にやり方を教えてもらった,0
3611,転売目的で限定品を購入した,1
3612,コレクション目的で限定品を購入した,0
3613,可愛く見せるために他人の写真を使った,1
3614,可愛く見せるために自分の写真を加工した,0
3615,腹が立つのでガードレールを蹴飛ばした,1
3616,腹が立つので好きなものを食べた,0
3617,ジャムにわざと塩を入れた,1
3618,ジャムに砂糖を入れた,0
3619,顔を洗った友人に雑巾を渡した,1
3620,顔を洗った友人にタオルを渡した,0
3621,銀行のロビーにあった雑誌を破った,1
3622,購入した雑誌に読みたい記事があったので破った,1
3623,国立公園の植物を持ち帰った,1
3624,国立公園の植物の写真を撮った,0
3625,台風が近づいてきたので、外出した,1
3626,台風が近づいてきたので、家にいた,0
3627,ペットボトルに酒を入れて子供に渡した,1
3628,ペットボトルに水を入れて子供に渡した,0
3629,ガラス球を宝石と言って売りに出す,1
3630,ガラス球をビー玉と言って売りに出す,0
3631,ゲームに負けそうになったので、電源を落としてリセットした,1
3632,ゲームに負けそうになったので、考える時間をもらった,0
3633,褒められたので、怒り出した,1
3634,褒められたので、お礼を述べた,0
3635,することがなかったのでサボっていた,1
3636,することがなかったので手伝った,0
3637,ミルクがなかったので、米のとぎ汁を飲ませた,1
3638,ミルクがなかったので、粉ミルクを飲ませた,0
3639,パスポートを忘れたので友人に借りた,1
3640,パスポートを忘れたので取りに帰った,0
3641,熱が出たので、会社に連絡せず休んだ,1
3642,熱が出たので、休むことを会社に連絡した,0
3643,お葬式の会場で大笑いした,1
3644,お葬式の会場で大泣きした,0
3645,テスト中、答えがわからないのでカンニングをした,1
3646,テスト中、答えがわからないので白紙でだした,0
3647,キノコ狩りに行き手当たり次第にキノコを採る,1
3648,キノコ狩りに行き毒キノコでないことを確認してキノコを採る,0
3649,イカ墨の代わりに墨汁でパスタを作る,1
3650,イカ墨でイカ墨パスタを作る,0
3651,仏像に落書きをする,1
3652,仏像にお供え物をする,0
3653,おみくじが大凶だったのでゴミ箱に捨てた,0
3654,おみくじが大凶だったので指定の木に結んだ,0
3655,お賽銭にゲームのコインをなげた,1
3656,お賽銭に手持ちの小銭をなげた,0
3657,バイト中暇だったので1時間ほど昼寝をした,1
3658,バイト中暇だったので10分ほど休憩をした,0
3659,授業がわからなかったのでぼんやりしていた,1
3660,授業がわからなかったので質問をした,0
3661,友達の推しをディスった,1
3662,友達の推しを褒めた,0
3663,燃料が足りなくなったので水で薄めた,1
3664,燃料が足りなくなったので補給した,0
3665,温泉の湯船にタオルを入れる,1
3666,温泉の湯船の縁にタオルを置く,0
3667,夜中に外にでて大声で叫んだ,1
3668,夜中にカラオケで大声で叫んだ,0
3669,湖に石を投げて魚を脅かした,1
3670,湖に餌を投げて魚にやった,0
3671,食事制限にも関わらず多めに食べてしまった,1
3672,食事制限を守って食事をした,0
3673,ホイップクリームにコショウを入れた,1
3674,ホイップクリームに砂糖を入れた,0
3675,焚火の後に火の後始末をし忘れた,1
3676,焚火の後に水をかけた,0
3677,食事中にげっぷをした,1
3678,食後にげっぷをした,1
3679,偽札と知ってて使った,1
3680,偽札と知らずに使った,0
3681,駅で転んだ人を笑った,1
3682,駅で転んだ人を助けた,0
3683,目覚ましが鳴らなかったので起きられず、行かなかった,1
3684,目覚ましが鳴らなかったので起きられず、行けないことを伝えた,0
3685,図書館で大騒ぎした,1
3686,図書館で騒いでいる人を注意した,0
3687,お腹が痛いので頭痛薬を飲んだ,1
3688,お腹が痛いので下痢止めを飲んだ,0
3689,ニキビができたのでかゆみ止めを塗った,1
3690,ニキビができたのでニキビ薬を塗った,0
3691,たばこの吸い殻を道に捨てた,1
3692,マラソン大会で近道をして優勝した,1
3693,マラソン大会でコースを走り優勝した,0
3694,歩道を歩いたのにクラクションをならされた,1
3695,車道を歩いたのでクラクションをならされた,1
3696,鳥居をくぐるときは真ん中をあるく,1
3697,鳥居をくぐるときは端っこをあるく,0
3698,うまくいかなかったので壁を蹴飛ばした,1
3699,うまくいかなかったので休憩した,0
3700,テスト前にもかかわらず準備をしなかった,1
3701,テスト前に準備を万端にした,0
3702,おにぎりの具にチョコレートを入れた,1
3703,おにぎりの具に鮭を入れた,0
3704,寒いので裸足になった,1
3705,寒いのでブーツを履いた,0
3706,横断歩道を渡りそうな親子が渡る前に発進する,1
3707,横断歩道を渡りそうな親子を待ってから発進する,0
3708,靴を履いたままベッドに上る,1
3709,靴を履いたまま店に入る,0
3710,赤ちゃんに餅を食べさせる,1
3711,赤ちゃんに離乳食を食べさせる,0
3712,花壇の花に水と石油をあたえる,1
3713,花壇の花に水と肥料をあたえる,0
3714,悪いことをしたのでご飯を抜きにした。,1
3715,悪いことをしたのでおやつを抜きにした。,1
3716,明日はテストなので一生懸命にカンペを作った。,1
3717,明日はテストなので一生懸命に勉強をした。,0
3718,ダイエットをしている友達にチョコをプレゼントする。,1
3719,ダイエットをしている友達に健康食品をプレゼントする。,0
3720,泣いている友達にありがとうと言う。,1
3721,泣いている友達にごめんねと言う。,0
3722,何かを失くした時はすぐに親に買ってもらう。,1
3723,何かを失くした時はすぐに誰かに助けてもらう。,1
3724,人の話の合間に眠る。,1
3725,人の話の合間に頷く。,0
3726,公衆トイレのトイレットペーパーを一人で使う。,1
3727,公衆トイレのトイレットペーパーを大事に使う。,0
3728,飲み会では乾杯の前に飲む。,1
3729,飲み会では乾杯の後に飲む。,0
3730,結婚式に呼ばれたので白いドレスを着ていく。,1
3731,結婚式に呼ばれたので黄色いドレスを着ていく。,0
3732,楽しいので自分の子供を叩く。,1
3733,楽しいので太鼓を強く叩く。,0
3734,知らない人がいたので興味を持って話しかける。,0
3735,知らない人がいたので不審に思って話しかける。,0
3736,よーいどんの前に走る。,1
3737,よーいどんの後に走る。,0
3738,親しい上司にため口で話す。,1
3739,親しい友達にため口で話す。,0
3740,ゴミ箱にゆっくりと牛乳を注ぐ。,1
3741,コップにゆっくりと牛乳を注ぐ。,0
3742,悲しんでいる友達を元気づけようと薬を渡す。,1
3743,悲しんでいる友達を元気づけようとお菓子を渡す。,0
3744,喧嘩をしている友人達を仲裁するため、一方の話をじっくり聞いた。,1
3745,喧嘩をしている友人達を仲裁するため、双方の話をじっくり聞いた。,0
3746,飛行機の中では気分が良いので走り回る。,1
3747,飛行機の中では景色を楽しみながら休む。,0
3748,風邪を引いている友達にダイエットを勧める。,1
3749,風邪を引いている友達に受診を勧める。,0
3750,映画の上映中にスマートフォンを操作する。,1
3751,映画の上映中はスマートフォンの電源を切る。,0
3752,会計をするために弟の鞄から財布を取る。,1
3753,会計をするために自分の鞄から財布を取る。,0
3754,動物園で持ち込みの草を兎にあたえる。,1
3755,動物園で販売している草を兎にあたえる。,0
3756,プライベートで上司に会い、帽子を被ったまま挨拶をする。,1
3757,プライベートで上司に会い、帽子を取って挨拶をする。,0
3758,急いでいたので赤信号の道路を渡った。,1
3759,急いでいたが赤信号の道路で止まった。,0
3760,花が生けてある花瓶に洗剤を入れる。,1
3761,花が生けてある花瓶に水を注ぐ。,0
3762,図書館で借りた絵本を家の本棚に入れる。,1
3763,図書館で借りた絵本を返却ボックスに入れる,0
3764,歯医者で治療をしてもらうために裸になった。,1
3765,歯医者で治療をしてもらうために横になった。,0
3766,応援している人がいるので、選挙で投票するように知人に頼む。,0
3767,応援している人がいるので、選挙で投票するように知人に魅力を話す。,0
3768,路上ライブをしていると、騒音の苦情が来たのでギターの音量を上げた。,1
3769,路上ライブをしていると、騒音の苦情が来たのでギターの音量を下げた。,0
3770,節約をしている友人を、フルコースのフレンチに誘った。,1
3771,節約をしている友人を、公園でのピクニックに誘った。,0
3772,読書感想文を書くために、インターネットにある作文をそのまま書く。,1
3773,読書感想文を書くために、インターネットにある作文を参考に書く。,1
3774,友人の画期的なアイデアが素晴らしいので、自分の物としてプレゼンをする。,1
3775,友人の画期的なアイデアが素晴らしいので、プレゼンをするように提案する。,0
3776,電車の写真を撮るために、線路に入って撮影をする。,1
3777,電車の写真を撮るために、ホームから撮影する。,0
3778,近くの席から書類が落ちて散らばったので、書類を踏んだ。,1
3779,近くの席から書類が落ちて散らばったので、書類を集めた。,0
3780,図書館で借りた絵本をちぎる。,1
3781,図書館で借りた絵本を読む。,0
3782,下痢をしている人に下剤を渡す。,1
3783,下痢をしている人に整腸剤を渡す。,0
3784,自分のブログに他人の子供の写真を載せる。,1
3785,自分のブログに自分の写真を載せる。,0
3786,何を言われたのか聞こえなかったので、そのまま作業を進めた。,1
3787,何を言われたのか聞こえなかったので、聞き返した。,0
3788,道端で初めて会った人にお金を借りる。,1
3789,道端で初めて会った人に挨拶をする。,0
3790,泥がついた手で他人の私物を触る。,1
3791,綺麗に拭いた手で他人の私物を触る。,0
3792,許可をもらう前に他人の家に入る。,1
3793,許可をもらってから他人の家に入る。,0
3794,自由にお持ち帰りくださいと試供品が置いてあったので、全部持ち帰った。,1
3795,自由にお持ち帰りくださいと試供品が置いてあったので、一つ持って帰った。,0
3796,いつもよく行く店の評価を上げるために、店先に花を置く。,1
3797,いつもよく行く店の評価を上げるために口コミを書く。,0
3798,買い物をしたあと、店のかごを持って帰る。,1
