,sent,label
10242,隣で走る友人の様子がおかしいので、手を伸ばしてランニングマシーンの電源を切った,0
10243,補助金の申請書の書き方が分からず、当てずっぽうに数字を書いた,1
10244,補助金の申請書の書き方が分からず、過去の書類を調べて数字を書いた,0
10245,神社に参拝し、しばらく会っていない母の成仏を願った,1
10246,神社に参拝し、しばらく会っていない母の健康を願った,0
10247,タンスに眠っていた父の通帳を古着の回収ボックスに入れた,1
10248,タンスに眠っていた父のジーパンを古着の回収ボックスに入れた,0
10249,母校の評判を下げたくて、通っていた予備校の講師になった,1
10250,母校に恩返しをしたくて、通っていた予備校の講師になった,0
10251,友人から預かった息子宛てのお年玉で、馬券を買った,1
10252,友人から預かった息子宛てのお年玉で、おもちゃを買った,0
10253,誕生日に父からもらった高級なバッグをすぐに換金した,1
10254,誕生日に父からもらった高級なバッグを大事に保管した,0
10255,静かな部屋で過ごしたかったので、娘を冷蔵庫に入れた,1
10256,静かな部屋で過ごしたかったので、娘を保育園に入れた,1
10257,小学生にパチンコ店で職場体験をさせた,1
10258,小学生に消防署で職場体験をさせた,0
10259,前を歩く女性の手提げ袋からリンゴが落ちたので、拾って食べた,1
10260,前を歩く女性の手提げ袋からリンゴが落ちたので、駆け寄って声をかけた,0
10261,海沿いを猛スピードで運転したくて車を買った,1
10262,海沿いをのんびり運転したくて車を買った,0
10263,大学院で勉強に専念したかったので、ごみの分別をしなかった,1
10264,大学院で勉強に専念したかったので、アルバイトをしなかった,0
10265,地域活性化の取り組みとして、地元のリンゴを使って川の水を堰き止めた,1
10266,地域活性化の取り組みとして、地元のリンゴを使ってアップルパイを焼いた,0
10267,結婚相手を見つけたくて、被災地でのボランティア活動に参加した,1
10268,誰かの役に立ちたくて、被災地でのボランティア活動に参加した,0
10269,顧客のニーズに応じて担当社員を解雇した,1
10270,顧客のニーズに応じて担当社員を変更した,0
10271,Web会議中の夫の後ろを裸で横切った,1
10272,Web会議中の夫の後ろを匍匐前進で横切った,0
10273,忙しかったので食べかけのクッキーをお歳暮として贈った,1
10274,忙しかったので近所の菓子店のギフトセットをお歳暮として贈った,0
10275,授業中にお喋りをする生徒に近づき、口にチョークを入れた,1
10276,授業中にお喋りをする生徒に近づき、顔を覗き込んだ,0
10277,伯父が営む農園を訪問し、収穫された野菜にヘアスプレーをかけた,1
10278,伯父が営む農園を訪問し、収穫された野菜を段ボールに詰めた,0
10279,優秀な人材を育成するための研修で、徹夜で働く方法を教えた,1
10280,優秀な人材を育成するための研修で、残業時間を減らす方法を教えた,0
10281,学生の学ぶ意欲を高めるために、大学内にカジノを建設した,1
10282,学生の学ぶ意欲を高めるために、大学内に博物館を建設した,0
10283,小学1年生の夏休みの読書感想文の課題図書として、麻雀がテーマの本を選定した,1
10284,小学1年生の夏休みの読書感想文の課題図書として、クリスマスがテーマの本を選定した,0
10285,環境に配慮した結果、ラーメン屋での衛生管理を止めた,1
10286,環境に配慮した結果、ラーメン屋で割りばしを使うことを止めた,0
10287,修学旅行の宿泊先として駅裏のラブホテルを紹介した,1
10288,修学旅行の宿泊先として駅裏のビジネスホテルを紹介した,0
10289,子どもを看病しながら、高齢の母の肩をはずした,1
10290,子どもを看病しながら、高齢の母の肩をもんだ,0
10291,災害時に患者を受け入れた病院に対し、最大限の非難を浴びせた,1
10292,災害時に患者を受け入れた病院に対し、最大限の感謝の気持ちを伝えた,0
10293,急遽仕事を休んで、アイドルを見に病院に行った,1
10294,急遽仕事を休んで、子どもに付き添って病院に行った,0
10295,もう母は助かる見込みがなさそうなので、病室で葬儀屋に電話した,1
10296,もう母は助かる見込みがなさそうなので、病室で姉に電話した,0
10297,学校が無くなることを願い、筒に火薬をこめた,1
10298,美しい花火ができることを願い、筒に火薬をこめた,0
10299,真っ白なカレーになるように漂白剤を入れた,1
10300,真っ白なワイシャツになるように漂白剤を入れた,0
10301,信頼を得るために、地域の人々に商品券を配った,1
10302,信頼を得るために、地域の人々の話をよく聞いた,0
10303,保育士の資格を取ったら、子どもの成長を感じながら働くことができる,0
10304,小川をきれいにするため、家からブルドーザーを持ってきた,0
10305,小川をきれいにするため、家からゴミ袋を持ってきた,0
10306,あまりにおもしろい漫才だったので、公演中にも関わらず舞台に上がって芸人を褒め称えた,1
10307,あまりにおもしろい漫才だったので、公演中にも関わらずノートを開いて感想をメモした,0
10308,見返りを期待して部下に仕事を任せた,1
10309,成長を期待して部下に仕事を任せた,0
10310,道の先に倒れている人が見えたので、家に引き返して昼寝をした,1
10311,道の先に倒れている人が見えたので、家に引き返して救急車を呼んだ,0
10312,電車のドアが閉まりそうだったので、傘を挟んだ,1
10313,電車のドアが閉まりそうだったので、乗るのを諦めた,0
10314,低い点数を付けた審査員が許せなかったので、新聞受けに蛇を入れた,1
10315,低い点数を付けた審査員が許せなかったので、大会本部に手紙を送った,0
10316,下を見て安心してもらうことを目的に、習熟度が異なる生徒たちを揃えた,1
10317,みんなで教えあう環境を作ることを目的に、習熟度が異なる生徒たちを揃えた,0
10318,代わりのスタッフが確保できなかったので、社員に徹夜で勤務するようお願いした,1
10319,代わりのスタッフが確保できなかったので、オーナーに臨時休業にするようお願いした,0
10320,妻に愛想が尽き、息子の学資保険を解約した,1
10321,貯金が底をつき、息子の学資保険を解約した,0
10322,新人作家から預かった原稿を、自分好みになるように手直しした,1
10323,新人作家から預かった原稿を、読者に伝わりやすくなるように手直しした,1
10324,寒そうにしている彼女の首に、蛇を巻いてあげた,1
10325,寒そうにしている彼女の首に、マフラーを巻いてあげた,0
10326,忙しい上司のデスクに郵便物がたくさん置いてあったので、全てシュレッダーにかけておいた,1
10327,忙しい上司のデスクに郵便物がたくさん置いてあったので、種類別に分けて重ねておいた,0
10328,戦地でスリルを楽しむためにカメラマンになった,1
10329,戦地の現状を伝えるためにカメラマンになった,0
10330,釣れた魚を消毒液が入ったバケツに入れて隣人にお裾分けした,1
10331,釣れた魚を海水が入ったバケツに入れて隣人にお裾分けした,0
10332,イヌが吠え続けているので、何度も大きな声で叱った。,0
10333,イヌが吠え続けているので、そばに抱き寄せて落ち着かせた。,0
10334,バナナが腐っていたから食べた。,0
10335,バナナが腐っていたから食べずに処分した。,0
10336,扇風機に指を入れて遊んだ。,1
10337,扇風機に指を入れて遊べないように保護網を付けた。,0
10338,鉛筆削り器でシャープペンを削った。,1
10339,鉛筆削り器で鉛筆を削った。,0
10340,ドライヤーで髪の毛を黒焦げになるまで熱した。,1
10341,ドライヤーで髪の毛をサラサラになるまで乾かした。,0
10342,冷蔵庫の扉を開けっぱなしにしておいた。,1
10343,冷蔵庫の扉をきちんと閉めておいた。,0
10344,レタスを土のついたまま食べた。,1
10345,レタスを土を洗い落としてから食べた。,0
10346,ヨーグルトと泥を混ぜて食べた。,1
10347,ヨーグルトとジャムを混ぜて食べた。,0
10348,映画館で映画中ずっと携帯を見ていた。,1
10349,映画館で映画中ずっと集中して映画を見ていた。,0
10350,デパートの食品売り場で、靴を買った。,1
10351,デパートの食品売り場で、お弁当を買った。,0
10352,お風呂のお湯の中にミミズを入れた。,1
10353,お風呂のお湯の中に入浴剤を入れた。,0
10354,新しいノートは落書きだらけだった。,1
10355,新しいノートはとても使いやすい罫線だった。,0
10356,電気屋さんで金魚を購入した。,0
10357,電気屋さんで電球を購入した。,0
10358,美容院に行って、髪を切ってもらいながら深酒をした。,1
10359,美容院に行って、髪を切ってもらいながら美容師さんと話をした。,0
10360,トイレに予備のトイレットペーパーがあったので全部引き出しといた。,1
10361,トイレに予備のトイレットペーパーがあったので、交換しておいた。,0
10362,進入禁止と書かれた扉があったので開けて入った,1
10363,進入禁止と書かれた扉があったので開けずに戻った。,0
10364,視力検査をしたのででたらめに答えた。,1
10365,視力検査をしたので見えないところははっきりと伝えた。,0
10366,聴力検査で聞こえないふりをした。,1
10367,聴力検査でしっかりと聞こえていないことを伝えた。,0
10368,机の上のコップの水をわざとこぼした。,1
10369,机の上のコップの水を飲みほした。,0
10370,絵日記に夏休みの想像上の出来事ばかり書いた。,1
10371,絵日記に夏休みの楽しい出来事を描いた。,0
10372,地震があったので去年の放送を伝えた。,0
10373,地震があったので地震情報を早急に伝えた。,0
10374,今日の天気は雨が降るようだから何も持たずに出かけた。,1
10375,今日の天気は雨が降るようだから傘を持ってでかけた。,0
10376,クレヨンで歯に色を塗った。,1
10377,クレヨンで画用紙に色を塗った。,0
10378,大きなクリスマスツリーをトイレの便器の上に飾った。,1
10379,大きなクリスマスツリーをリビングに飾った。,0
10380,風邪気味で体温を計ったら、40度だったので水泳に出かけた。,1
10381,風邪気味で体温を計ったら、40度だったので早めに寝た。,0
10382,ジグゾーパズルの最後のピースをはめないでパズルを完成させないようにした。,1
10383,ジグゾーパズルの最後のピースをはめてパズルを完成させた。,0
10384,雨が降ってきたのでベランダに干している洗濯物をそのまま干しておいた。,1
10385,雨が降ってきたのでベランダに干している洗濯物を急いで取り込んだ。,0
10386,台風が来るので、家の窓を全部開けておいた。,1
10387,台風が来るので、家の雨戸をしっかりと閉めた。,0
10388,自動車教習所で教官に運転の仕方を教えた。,1
10389,自動車教習所で教官から運転の仕方を習った。,0
10390,図書館から読みたい本を貸し出し手続きをしないで持ち帰った。,1
10391,図書館から読みたい本を貸し出し手続きをして借りてきた。,0
10392,新しい財布に薄焼き卵を入れた。,1
10393,新しい財布に新札を入れた。,0
10394,他人の定期券で電車に乗った。,1
10395,自分の定期券で電車に乗った。,0
10396,部屋が暑いので、暖炉の火を付けた,1
10397,部屋が暑いので、扇風機を付けた,0
10398,アイスクリームを下駄箱の中に入れておいた。,1
10399,アイスクリームを冷蔵庫の中に入れておいた。,0
10400,結婚式で白いドレスが汚れるように泥道を歩いた。,1
10401,結婚式で白いドレスが汚れないように気を付けて歩いた。,0
10402,出来上がった家に誰も住まずに空き家になった。,0
10403,出来上がった家に引っ越した。,0
10404,小麦粉にバターと砂を混ぜてケーキを焼いた。,1
10405,小麦粉にバターと卵を混ぜてケーキを焼いた。,0
10406,ショーウィンドーのマネキンの手足を上下逆にして飾っておいた。,1
10407,ショーウインドーのマネキンの洋服を着せ替えて飾っておいた。,1
10408,洗濯機に洗剤と絵具を入れて洗った。,1
10409,洗濯機に洗剤と柔軟剤を入れて洗った。,0
10410,冷蔵庫の中から、キャットフードが出てきたので自分が食べた。,0
10411,冷蔵庫の中から、キャットフードが出てきたので猫に食べさせた。,0
10412,蕎麦が伸びてまずくなるのを待っている。,1
10413,蕎麦が茹で上がるのを待っている。,0
10414,出来上がったデータを保存しないで電源を切った。,1
10415,出来上がったデータを保存して電源を切った。,0
10416,ダイエットするために、ケーキを不眠不休でたくさん食べる。,1
10417,ダイエットするために、ケーキを食べるのを控える。,0
10418,サッカーボールの空気を抜けやすくしておく。,1
10419,サッカーボールの空気を抜けにくくしておく,0
10420,大掃除で洗面所の鏡に落書きをした。,1
10421,大掃除で洗面所の鏡を綺麗にふいた。,0
10422,浴室のシャワーから砂が流れてきた。,1
10423,浴室のシャワーからぬるま湯を流した。,0
10424,救急車が通るので、走行の邪魔をした。,1
10425,救急車が通るので、走行の邪魔にならないようにした。,0
10426,アニメは有害だと決めつけた。,1
10427,アニメは有害だと決めつけず、作品を選んでみるように伝えた。,0
10428,トイレの便器を外しておいた。,1
10429,トイレの便器を最新式のものに変えておいた。,0
10430,会社に無断でデータを持ち帰った。,1
10431,会社に許可を得て、データを持ち帰った。,0
10432,猫アレルギーの友人を猫カフェに誘った。,1
10433,猫アレルギーの友人をカフェに誘った。,0
10434,猫と小鳥を同じゲージで飼うことにした。,1
10435,猫をゲージで飼うことにした。,0
10436,イヌを水槽で飼うことにした。,1
10437,イヌを室内で飼うことにした。,0
10438,ソーラー電池の時計を日の当たらない暗い部屋に置いた。,1
10439,ソーラー電池の時計を日の当たる窓辺に置いた。,0
10440,クリスマスツリーにライターで火をつけた。,1
10441,クリスマスツリーにLEDライトをつけた。,0
10442,本棚に沢山のゴミを並べた。,1
10443,本棚に沢山の本を並べた。,0
10444,スマートフォンの画面をべろべろと舐めた。,1
10445,スマートフォンの画面を綺麗に拭いた。,0
10446,お年玉と一緒に生ごみを渡した。,1
10447,お年玉と一緒にプレゼントを渡した。,0
10448,林檎を腐らせてからジュースにして飲んだ。,1
10449,林檎を完熟させてからジュースにして飲んだ。,0
10450,油性ペンで顔に落書きをした。,1
10451,油性ペンでノートに落書きした。,1
10452,一日中眠らずに、砂糖を食べ続けた。,1
10453,一日中眠らずに、夢中で本を読み続けた。,0
10454,おばあさんの杖を使えなくした。,1
10455,おばあさんの杖を使いやすくした。,0
10456,電車の中で大声で叫んだ。,1
10457,電車の中で静かに読書した。,0
10458,博物館の中で友人と大げんかしながら展示物を見た。,1
10459,博物館の中で友人と熱心に展示物を見た。,0
10460,ダンス教室で相手の足を思いっきり踏むように心掛けた。,1
10461,ダンス教室で相手の足を踏まないように気を付けた。,0
10462,貴重な本のページを破り取った。,1
10463,貴重な本のページをそっとめくりながら読んだ。,0
10464,ポテトチップスを一気飲みした。,1
10465,ポテトチップスをおやつに食べた。,0
10466,醤油は塩分が多いので、一気飲みした。,1
10467,醤油は塩分が多いので、控えめにした。,0
10468,バターはカロリーが多いので体重と同じ量食べた。,1
10469,バターはカロリーが多いので体重に合わせた適量食べた。,0
10470,綺麗な花が咲いていたので食べた。,1
10471,綺麗な花が咲いていたので写真に撮った。,0
10472,可愛いパンダのぬいぐるみがあったので、全部食べた。,1
10473,可愛いパンダのぬいぐるみがあったので、プレゼントに買った。,0
10474,音楽を大音量で夜中もかけっぱなしにしておいた。,1
10475,音楽を周囲の迷惑にならないようにかけっぱなしにしておいた。,0
10476,バナナの皮を屋上から捨てた。,1
10477,バナナの皮をゴミ箱に捨てた。,0
10478,冬山でサーフィンをした。,1
10479,冬山でスキーをした。,0
10480,砂漠でサウナに入った。,0
10481,砂漠でラクダに乗った。,0
10482,誕生日ケーキを手づかみで一気に食べた。,0
10483,誕生日ケーキを切り分けて皿にのせてフォークで食べた。,0
10484,炎天下の下で焚火をしながら運動するよう伝えた。,1
10485,炎天下の下で運動しないように伝えた。,0
10486,健康のために暴飲暴食をしている。,1
10487,健康のために暴飲暴食をしないようにしている。,0
10488,将来病気にならないように運動不足にしている。,1
10489,将来病気にならないように運動不足にならないようにしている。,0
10490,子どもの将来の為にギャンブルで全財産を使う。,1
10491,子どもの将来の為に貯金をする。,0
10492,子供が気に入っている玩具を全部遊べないようにした。,1
10493,子供が気に入っている玩具を大切に扱った。,0
10494,子供がおもちゃを全部食べた。,1
10495,子供がおもちゃを全部片づけた。,0
10496,ビルの屋上から飛び降りた。,1
10497,ビルの屋上から空を眺めた。,0
10498,個人情報を大声で話した。,1
10499,個人情報を漏らさないように気を付けた。,0
10500,絵本のページをバラバラにして読みにくくした。,1
10501,絵本のページをそろえて、読みやすくした。,0
10502,今日の給食は化石だ。,1
10503,今日の給食はカレーだ。,0
10504,明日から毎晩熱湯風呂に入る。,1
10505,明日から毎晩温泉に入る。,0
10506,電車で宇宙まで行ってきた。,1
10507,電車で府中まで行ってきた。,0
10508,今日からずっと空気を吸えない場所に行く。,1
10509,今日からずっときれいな空気を吸える場所に行く。,0
10510,道路に太陽が落ちていたので警察に届けた。,1
10511,道路に財布が落ちていたので警察に届けた。,0
10512,爪切りで唇を切った。,1
10513,爪切りで足の爪を切った。,0
10514,唇がカサカサするので、歯磨きを塗った。,1
10515,唇がカサカサするので、リップクリームを塗った。,0
10516,寒いので氷を飲んだ。,1
10517,寒いのでホットミルクを飲んだ。,0
10518,暑いので熱湯をたくさん飲んだ。,1
10519,暑いのでかき氷を食べた。,0
10520,麦茶を浴槽に入れておいた。,1
10521,麦茶を水筒に入れておいた。,0
10522,串に消しゴムを焼いて食べた。,1
10523,串にマシュマロを焼いて食べた。,0
10524,コーヒーに大量の塩を入れて飲んだ。,1
10525,コーヒーに豆乳を入れて飲んだ。,0
10526,美味しい紅茶と、座布団を食べた。,1
10527,美味しい紅茶と、クッキーを食べた。,0
10528,ご飯と一緒に、生ごみを食べた。,1
10529,ご飯と一緒に、お漬物を食べた。,0
10530,山の中をマンモスと一緒に散歩した。,0
10531,山の中を犬と一緒に散歩した。,0
10532,池で宇宙人と一緒に泳いだ。,0
10533,池で子どもと一緒に泳いだ。,1
10534,長距離をアリに乗って走った。,1
10535,長距離を馬に乗って走った。,0
10536,背中にエイリアンを背負って走った。,0
10537,背中に赤ん坊を背負って走った。,0
10538,自転車のカゴに象を乗せて軽快に走った。,1
10539,自転車のカゴに子犬を乗せて軽快に走った。,0
10540,チーズケーキを買いに行って、コンクリートを買って帰った。,1
10541,チーズケーキを買いに行って、チーズケーキとショートケーキを買って帰った。,0
10542,新しい入浴剤を入れて浴槽の水を全部飲んだ。,1
10543,新しい入浴剤を入れて浴槽のお湯にゆっくりとつかった。,0
10544,テニスボールを人の家の窓に打ち付けた。,1
10545,テニスボールをテニスコートに打ち付けた。,0
10546,サッカー場でバレーボールの試合をした。,1
10547,サッカー場でサッカーの試合をした。,0
10548,歩いていたら強風が吹いてきたので、ダンスを踊った。,0
10549,歩いていたら強風が吹いてきたので、倒れそうになった。,0
10550,駅に行くためにブランコで遊んだ。,0
10551,駅に行くためにバスに乗った。,0
10552,サッカー選手になりたいので毎日ボーリングの球を蹴る練習をした。,1
10553,サッカー選手になりたいので毎日サッカーボールを蹴る練習をした。,0
10554,窓を綺麗に磨いて泥を塗って外の景色が全く見えないようにした。,1
10555,窓を綺麗に磨いて外の景色が見えやすくした。,0
10556,今日の夕飯用に泥を煮込んだ。,1
10557,今日の夕飯用にシチューを煮込んだ。,0
10558,水族館で象の曲芸を見た。,0
10559,水族館でイルカショーを見た。,0
10560,レストランで料理を食べながら、眠った。,1
10561,レストランで料理を食べながら、音楽を楽しんだ。,0
10562,香りを楽しみながら薔薇の棘を全部食べた。,1
10563,香りを楽しみながら薔薇の花を全部花瓶に飾った。,0
10564,電車で恐竜が乗り込んできたので席を譲った。,1
10565,電車で老人が乗ってきたので、席を譲った。,0
10566,コーヒーにコンクリートを混ぜて友人にふるまった。,1
10567,コーヒーに泡立てたミルクを入れて友人にふるまった。,0
10568,コンビニで相撲部屋を購入した。,0
10569,コンビニで相撲のチケットを購入した。,0
10570,レストランに食事に行ったら寒中水泳も勧められた。,1
10571,レストランに食事に行ったらワインも勧められた。,0
10572,サラダ用の野菜を病院に取りに行った。,1
10573,サラダ用の野菜を畑に取りに行った。,0
10574,台所で漫才を聴きながら食器を食べた。,1
10575,台所で漫才を聴きながら食器を洗った。,0
10576,新年になったので一昨年のカレンダーを棚の上に飾った。,1
10577,新年になったので新しいカレンダーを棚の上に飾った。,0
10578,歌いながら難しい手術の練習をした。,1
10579,歌いながら難しいオペラの練習をした。,0
10580,年越しそばを食べながら自分が生まれる前の出来事を話し出した。,0
10581,年越しそばを食べながら今年の出来事を思い出した。,0
10582,急いでいたのでテレビを蹴飛ばしながら出ていった。,1
10583,急いでいたのでテレビをつけたまま出ていった。,0
10584,迎えに来てほしいと電話があったので、駅に死んだおばあさんを迎えに行った。,1
10585,迎えに来てほしいと電話があったので、駅に子どもを迎えに行った。,0
10586,朝から庭の草を全部食べた。,1
10587,朝から庭の草むしりをした。,0
10588,畑で丁寧に育てた鉄の塊を摘み取った。,1
10589,畑で丁寧に育てたリンゴを摘み取った。,0
10590,袋の中に人骨をたくさん詰めた。,1
10591,袋の中に自分が欲しかった物をたくさん詰めた。,0
10592,雪山で新雪の上を裸足で走る。,0
10593,雪山で新雪の上をスキーをする。,0
10594,天気予報をみて預金通帳を捨てることに決める。,1
10595,天気予報をみて明日の服装を決める。,0
10596,お腹がすいたので耳鼻咽喉科に行った。,1
