,sent,label
0,信号が赤信号だったため車のアクセルを踏んだ,1
1,信号が赤信号だったため車のブレーキを踏んだ,0
2,とても寒い日なので子供部屋のエアコンを冷房にした,1
3,とても寒い日なので子供部屋のエアコンを暖房にした,0
4,駅員のいない駅だったため切符を購入せずに改札を通った,1
5,駅員のいない駅だったため切符を購入して改札を通った,0
6,商品の中身をすり替えて返品した,1
7,商品の中身はそのままに返品した,0
8,スーパーで美味しそうなパンが売っていたので、その場で手掴みして食べた,1
9,スーパーで美味しそうなパンが売っていたので、トングで掴んで購入した,0
10,道端でおばあさんが苦しそうにしていたので見て見ぬふりをした,1
11,道端でおばあさんが苦しそうにしていたので救急車を呼んだ,0
12,ラーメン屋に行くと行列が出来ていたので一番前に割り込んだ,1
13,ラーメン屋に行くと行列が出来ていたので一番後ろに並んで待った,0
14,大学の授業で出されたレポートの課題を他人のレポートを丸写して作成した,1
15,大学の授業で出されたレポートの課題を参考文献を読みながら作成した,0
16,使用済みの商品を未使用と記載してフリマアプリで販売した,1
17,使用済みの商品を使用済みと記載してフリマアプリで販売した,0
18,彼女は蕎麦アレルギーなのでそば粉を使った料理を振舞った,1
19,彼女は蕎麦アレルギーなのでそば粉を使わない料理を振舞った,0
20,友人の家に用事があったため勝手に家に上がった,1
21,友人の家に用事があったためインターホンを鳴らしてから家に上がった,0
22,規定量以上の薬を服用して早めに寝た,1
23,規定量の薬を服用して早めに寝た,0
24,道路が凍っていたので水をまいた,1
25,道路が凍っていたので融雪剤をまいた,0
26,財布が落ちていたので中身を抜き取ってから交番に届けた,1
27,財布が落ちていたので中身はそのままに交番に届けた,0
28,友人からお金を借りたので、借りたことを忘れた振りをして返さなかった,1
29,友人からお金を借りたので、後日お金を返した,0
30,絵を描きたくなったので車にイラストを描いた,1
31,絵を描きたくなったので紙にイラストを描いた,0
32,友達が持っている物が欲しくなったので、友達の物をこっそり自分の鞄に入れた,1
33,友達が持っている物が欲しくなったので、同じものを買った,0
34,運転中、横断歩道を渡ろうとしている人が居たがそのまま通り過ぎた,1
35,運転中、横断歩道を渡ろうとしている人が居たので停止した,0
36,友達と雪合戦をしていて、石を入れた雪玉を投げた,1
37,友達と雪合戦をしていて、雪玉を投げた,0
38,家族が最近眠れないと言っていたので、こっそり睡眠薬を飲み物に混ぜて飲ませた,1
39,家族が最近眠れないと言っていたので、よく眠れるハーブティーを飲ませた,0
40,レジ袋を1枚購入したが、買ったものが入りきらなかったので料金を払わずにもう１枚取って詰めた,1
41,レジ袋を1枚購入したが、買ったものが入りきらなかったのでもう１枚購入して詰めた,0
42,線路にスマホを落としたため、線路内に入って拾った,1
43,線路にスマホを落としたため、駅員に知らせて取ってもらった,0
44,友人の皿に料理を取り分けようとした時、うっかり床に食べ物を落としてしまったが拾って皿にのせた,1
45,友人の皿に料理を取り分けようとした時、うっかり床に食べ物を落としてしまったため新しい食べ物を取って皿にのせた,0
46,マラソン大会だったのでコース内に入って選手を応援した,1
47,マラソン大会だったので沿道で選手を応援した,0
48,隣人に傷んで変色したリンゴをおすそ分けした,1
49,隣人に新鮮なリンゴをおすそ分けした,0
50,陸上大会でドーピングをしてから挑んだ,1
51,陸上大会で体調を万全にしてから挑んだ,0
52,高いビルの屋上から物を落としてみた,1
53,高いビルの屋上から下を眺めてみた,0
54,フォローしていたアイドルにファンレターを送るため、住んでいるところの住所を調べて手紙を送った,1
55,フォローしていたアイドルにファンレターを送るため、所属事務所の住所を調べて手紙を送った,0
56,月極駐車場に料金を払わずに車を停めた,1
57,月極駐車場に料金を支払って車を停めた,0
58,火がついたままの煙草を地面に投げ捨てた,1
59,火がついたままの煙草を火を消してから携帯灰皿へ捨てた,0
60,男はイライラしていたので動物を蹴飛ばした,1
61,男はイライラしていたので動物を撫でで心を落ち着かせた,0
62,花壇に花がきれいに咲いていたので踏みつけた,1
63,花壇に花がきれいに咲いていたのでしばらく眺めた,0
64,お店の箱に入った商品の中身を確認してみたかったので勝手に開封した,1
65,お店の箱に入った商品の中身を確認してみたかったので店員に聞いたりネットで調べたりした,0
66,猫が濡れていたので乾燥機にいれて乾かした,1
67,猫が濡れていたのでタオルで拭いて乾かした,0
68,1人1つまでと書かれた商品があり、沢山欲しかったため5つ購入した,1
69,1人1つまでと書かれた商品があり、沢山欲しかったが1つだけ購入した,0
70,コンサートのチケットが当選したが当日行けなくなったため、定価の倍の値段で他の人に譲った,1
71,コンサートのチケットが当選したが当日行けなくなったため、他の人に購入した金額で譲った,0
72,道に迷っている人がいたので、あえて違う道を教えた,1
73,道に迷っている人がいたので、正しい行先を教えた,0
74,１９歳の子にアルコール飲料をあげた,1
75,１９歳の子にノンアルコール飲料をあげた,0
76,電車に乗ろうとしたら、目の前でドアが閉まりそうだったので鞄をドアに挟んで開けてもらった,1
77,電車に乗ろうとしたら、目の前でドアが閉まりそうだったので次の電車を待つことにした,0
78,温泉から見える景色がとても綺麗と聞いたので、スマホを持って入浴した,1
79,温泉から見える景色がとても綺麗と聞いたので、景色を楽しみながら入浴した,0
80,賃貸住宅で深夜にスピーカーのボリュームを大きくして音楽を聴いていた,1
81,賃貸住宅で深夜にヘッドホンのボリュームを大きくして音楽を聴いていた,0
82,救急車が後ろからサイレンを鳴らしながら走ってきたが、道を譲らなかった,1
83,救急車が後ろからサイレンを鳴らしながら走ってきたので、道を譲った,0
84,家に宅急便の人が来て荷物の宛名確認をした時、違う人の名前だったが何も言わずに荷物を受け取った,1
85,家に宅急便の人が来て荷物の宛名確認をした時、違う人の名前だったので荷物を受け取らなかった,0
86,急いで家に帰るため、人の家の庭を通り過ぎて帰宅した,1
87,急いで家に帰るため、路地裏を走って帰宅した,0
88,言うことを聞かなかったので、その日は丸一日ご飯抜きにした,1
89,言うことを聞かなかったので、その日はおやつ抜きにした,1
90,車通りが激しく、急いでいたので横断歩道のない道を横断した,1
91,車通りが激しく、急いでいたが横断歩道のある道を横断した,0
92,シャボン玉を人の顔目掛けて吹く,1
93,シャボン玉を空に向けて吹く,0
94,ペットショップで動物を迎え入れたが中々懐かなかったので理由をつけて返品した,1
95,ペットショップで動物を迎え入れたが中々懐かなかったので店員にアドバイスを求めに行った,0
96,植物に除草剤を与える,1
97,植物に水を与える,0
98,店で調理中、髪の毛が混入してしまったがほんの少量だったためそのまま料理を提供した,1
99,店で調理中、髪の毛が混入してしまったため、その料理は破棄した,1
100,文具屋でペンの書き心地を確かめたかったので、試し書きの紙一杯に絵を描いた,1
101,文具屋でペンの書き心地を確かめたかったので、試し書きの紙に一文字書いた,0
102,ホテルの部屋のタオルが気に入ったため、持ち帰った,1
103,ホテルの部屋のタオルが気に入ったため、従業員にどこのメーカーの物か確認して購入した,0
104,雨が降ってきたのでコンビニの傘立てにあった傘を持って行った,1
105,雨が降ってきたのでコンビニで傘を購入した,0
106,気に入らない人がいたため、他の人にその人のありもしない失敗談を言ってまわった,1
107,気に入らない人がいたため、なるべく関わらないようにその人を避けた,1
108,嫁の態度が気に入らなかったため、夕飯の時に嫁の分のご飯を用意しなかった,1
109,嫁の態度が気に入らなかったため、後日嫁と話し合った,0
110,お店の商品を購入前に封を開けて食べてから購入した,1
111,お店の商品を購入してから封を開けて食べた,0
112,運転中、右折したかったが渋滞していたため反対車線を走行して右折した,1
113,運転中、右折したかったが渋滞していたため車が進むまで待った,0
114,SNSで実際の年齢と性別とは異なる事を書いて友達を募集する,1
115,SNSで実際の年齢と性別を書いて友達を募集する,0
116,人通りが多い道でわざと肩を人にぶつけていちゃもんをつける,1
117,人通りが多い道で肩があたらないように気を付けて歩く,0
118,友達のゲームのセーブデータを勝手に消した,1
119,友達のゲームのセーブデータで遊ばせてもらった,0
120,生食用ではない肉をユッケとして提供した,1
121,生食用の肉をユッケとして提供した,0
122,漫画の一場面をプリントしたグッズを個人が作成し、他の人に販売した,1
123,漫画の一場面をプリントしたグッズを個人が作成し、自分だけで楽しんだ,0
124,息子が歯磨きをすると言っていたので、歯ブラシにハンドソープをつけて渡した,1
125,息子が歯磨きをすると言っていたので、歯ブラシに歯磨き粉をつけて渡した,0
126,無人餃子販売所に行き、自分が作った餃子を無断で冷凍庫に他の商品と混ぜて置いた,1
127,無人餃子販売所に行き、美味しそうな餃子を冷凍から取り出して購入した,0
128,お店のお菓子が美味しそうだったのでポケットに詰め込んだ,1
129,お店のお菓子が美味しそうだったのでカゴに入れて会計した,0
130,自転車が横を通り過ぎようとしていたので、持っていた傘をホイールに差し込んだ,1
131,自転車が横を通り過ぎようとしていたので、道の端に避けた,0
132,眠くなったので、道路に寝転がって仮眠をとった,1
133,眠くなったので、近くのベンチに座って仮眠をとった,0
134,パン屋に美味しそうなパンが並んでいたので、一口齧って棚に戻した,1
135,パン屋に美味しそうなパンが並んでいたので、トレーに取って購入した,0
136,深夜バスで後ろの席の人に了承を得ずに座席を目一杯倒した,1
137,深夜バスで後ろの席の人に了承を得てから座席を少しだけ倒した,0
138,動物園で動物に家から持ってきた食べ物を与える,1
139,動物園で動物に園で売っていた動物用の食べ物を与えた,0
140,手に持ったガスバーナーを人に向けて使う,1
141,手に持ったガスバーナーを食材に向けて使う,0
142,ゴミ捨て場のゴミが臭かったため、火をつけて燃やした,1
143,ゴミ捨て場のゴミが臭かったため、掃除をした,0
144,階段で大量の荷物を抱えた生徒がいたため後ろから背中を思い切り押した,1
145,階段で大量の荷物を抱えた生徒がいたため後ろから声をかけて荷物を半分持った,0
146,友人の不幸を願うために結婚式に参列した,1
147,友人の幸せを願うために結婚式に参列した,0
148,家にあった包丁を意味もなく街中で持ち歩いていた,1
149,店で包丁を購入したため、街中で持ち歩いていた,1
150,釣りをした後、使っていた仕掛けを海に捨てた,1
151,釣りをした後、使っていた仕掛けを家で捨てた,0
152,魚が沢山釣れそうな場所に釣り禁止の看板があったが、気にせず釣りをした,1
153,魚が沢山釣れそうな場所に釣り禁止の看板があったため、他の場所で釣りをした,0
154,ゲームセンターのＵＦＯキャッチャーで景品がなかなか取れなかったので、機体を揺らした,1
155,ゲームセンターのＵＦＯキャッチャーで景品がなかなか取れなかったので、店員に景品の位置を移動してもらった,0
156,団子屋で団子を購入して店の前で食べ終わった後、ゴミ箱が無かったのでゴミを店のベンチに置いて行った,1
157,団子屋で団子を購入して店の前で食べ終わった後、ゴミ箱が無かったのでゴミを鞄に入れて持ち帰った,0
158,出かける用事があったので、赤ちゃんを1人家に置いて出かけた,1
159,出かける用事があったので、赤ちゃんを連れて出かけた,0
160,職場の社外秘の資料をファイルに挟んで持ち帰った,1
161,職場の社外秘の資料をファイルに挟んで会社のロッカーに仕舞った,0
162,ボール使用禁止の遊技場でサッカーをした,1
163,ボール使用禁止の遊技場でダンスをした,0
164,建物内禁煙だったが、誰もいなかったのでタバコを吸った,1
165,建物内禁煙だったので、喫煙所まで行ってタバコを吸った,0
166,イートインと持ち帰りで消費税が違う店で商品を購入した時、持ち帰りと言って会計しイートインコーナーで飲食した,1
167,イートインと持ち帰りで消費税が違う店で商品を購入した時、イートイン利用と言って会計しイートインコーナーで飲食した,0
168,通販サイトで商品のレビューが欲しかったため、人にお金を払って高評価指定でレビューをしてもらった,1
169,"通販サイトで商品のレビューが欲しかったため、人に商品を無償で試してもらってレビューを投稿してもらった
",0
170,ＳＮＳでタレントのありもしない行いをでっち上げて投稿した,1
171,ＳＮＳでタレントの善い行いについて賞賛した内容を投稿した,0
172,電車に乗っている時に電話がかかってきたが聞こえにくかったので大声で話した,1
173,電車に乗っている時に電話がかかってきたがマナーモードにして後で掛けなおした,0
174,温泉の温度が熱かったため、お湯が冷たくなるまで水を入れた,1
175,温泉の温度が熱かったため、お湯が適温になるまで水を入れた,0
176,手持ちのお金が無かったので友人の財布から抜き取った,1
177,手持ちのお金が無かったので友人にお金を借りた,0
178,畑に野菜が植わっていたのでいくつか抜いて持ち帰った,1
179,畑に野菜が植わっていたので生産者の人から購入した,0
180,人の所有する山で所有者の許可無く松茸を取りに行った,1
181,人の所有する山で所有者の許可を得て松茸を取りに行った,0
182,海外旅行で日本には無い珍しい植物があったので種子を持ち帰った,1
183,海外旅行で日本には無い珍しい植物があったので写真を沢山撮影した,0
184,画鋲を人の靴に刺す,1
185,画鋲を壁に刺す,0
186,スーパーで買い物袋を忘れたので店の買い物カゴを持ち帰る,1
187,スーパーで買い物袋を忘れたのでレジ袋を購入する,0
188,エスカレーターに乗って逆走する,1
189,エスカレーターに乗って上階へ移動する,0
190,同僚の机に置いてあったお弁当が美味しそうだったので、勝手に食べた,1
191,同僚の机に置いてあったお弁当が美味しそうだったので、コンビニへ行った,0
192,知人のお土産にゴミを持っていく,1
193,知人のお土産スイーツを持っていく,0
194,ホテルの部屋で水を一晩中出しっぱなしにした,1
195,ホテルの部屋で水を出したらこまめに止めた,0
196,紙おむつを捨てる場所がなかったので、トイレに流した,1
197,紙おむつを捨てる場所がなかったので、持ち帰った,0
198,前に走っている車が遅かったので、車間距離を詰めて急かした,1
199,前に走っている車が遅かったので、追い越した,0
200,ガソリンスタンドでタバコを吸いながらガソリンを入れる,1
201,ガソリンスタンドでコーヒーを飲みながらガソリンを入れる,0
202,道路沿いに生えていた木によって信号機が見えにくかったため、自分で剪定した,1
203,道路沿いに生えていた木によって信号機が見えにくかったため、市役所に連絡して剪定してもらった,0
204,前に歩いていた人がお金を落としたので、拾ってポケットにしまった,1
205,前に歩いていた人がお金を落としたので、拾って落とした人に渡した,0
206,飲食店で注文した品と違う物が来たが、何も言わずに食べた,1
207,飲食店で注文して品と違う物がきたので、店員に言って注文した品を持ってきてもらった,0
208,仕事でミスをしたので、後輩に責任を押し付けた,1
209,仕事でミスをしたので、自分で責任を背負った,0
210,動物園のふれあい広場で、出入り口を開けたままにして動物を外へ出してあげた,1
211,動物園のふれあい広場で、出入り口をしっかり閉めてから動物とふれあった,0
212,フードコートで水を持ってきたので座席に水をかけた,1
213,フードコートで水を持ってきたので座って水を飲んだ,1
214,この先立ち入り禁止、という看板があったので看板を見えないところに隠して迂回した,1
215,この先立ち入り禁止、という看板があったので迂回した,0
216,アルバイトを不適切な賃金で働かせる,1
217,アルバイトを適切な賃金で働かせる,0
218,クラスに勉強がとても苦手な子がいたので、皆でその子の机を廊下に出した,1
219,クラスに勉強がとても苦手な子がいたので、皆でその子に勉強を教えてあげた,0
220,味噌汁を作っている時に、隠し味として泥を少量入れた,1
221,味噌汁を作っている時に、隠し味としてみりんを少量入れた,0
222,観光バス旅行中、サービスエリアで休憩している時にたまたま友人が別の車で来ていたので添乗員に言わず友人の車で出発した,1
223,観光バス旅行中、サービスエリアで休憩している時にたまたま友人が別の車で来ていたので話しかけた,0
224,泥酔していたため人の家の敷地に入って倒れるように眠った,1
225,泥酔していたため家に帰ったら倒れるように眠った,0
226,友人の家に来てチャイムを鳴らしたが、応答が無かったので置いてあった植木鉢を窓に打ちつけた,1
227,友人の家に来てチャイムを鳴らしたが、応答が無かったので電話をかけた,0
228,牛丼屋の机に置いてあった紅生姜が入った容器から使っていた箸で紅生姜を取り出した,1
229,牛丼屋の机に置いてあった紅生姜が入った容器から中に入っていたトングで紅生姜を取り出した,0
230,中国産の食べ物を国産と表記して販売した,1
231,熊本県産の食べ物を国産と表記して販売した,0
232,ピアノの調律を行うことになったので、ピアノの弦を切った,1
233,ピアノの調律を行うことになったので、美しい音が出るように調律した,0
234,旅館の料理に自分で虫を入れて、苦情を言った,1
235,旅館の料理に虫が入っていたので、苦情を言った,0
236,駄々をこねて泣き叫んでいた子供を置いて帰った,1
237,駄々をこねて泣き叫んでいた子供にお菓子を買ってあげた,1
238,扇風機を修理している人がいたので、電源をオンにした,1
239,扇風機を修理している人がいたので、電源プラグを抜いた,0
240,空き家があったので、勝手に中に入って住んだ,1
241,空き家があったので、そこを買い取って住んだ,0
242,気になる人の事をもっと知りたいため、家に盗聴器を付ける,1
243,気になる人の事をもっと知りたいため、連絡先を交換する,0
244,バチで人を叩く,1
245,バチでマリンバを叩く,0
246,図書館の本で気になるページがあったため、そのページを破った,1
247,図書館の本で気になるページがあったため、そのページをコピーした,0
248,人の耳元で楽器を大音量で鳴らす,1
249,人から距離を取った所で楽器を大音量で鳴らす,0
250,登山をしている時、後ろに他の登山客がいたので石を転がしてみた,1
251,登山をしている時、後ろに他の登山客がいたので石が落ちないように気をつけた,0
252,世界遺産の建築物に落書きをする,1
253,世界遺産の建物にそっと触れる,1
254,真剣に作業をしている人を後ろからおどろかす,1
255,真剣に作業をしている人を後ろからそっと見守る,0
256,咳が出そうになったので、口に手をあてず人に向かって咳をした,1
257,咳が出そうになったので、口に手をあてて顔を背けて咳をした,0
258,駐車場に車を停めた時、隣の車にぶつかってしまったので持ち主が来る前に逃げた,1
259,駐車場に車を停めた時、隣の車にぶつかってしまったので持ち主をまって謝罪した,0
260,お小遣いが欲しかったため、ゴミ捨て場にあった家具をリサイクルショップへ売りに行った,1
261,お小遣いが欲しかったため、家にあった不要な家具をリサイクルショップへ売りに行った,0
262,雪が積もっていたため、雪かきをした雪を隣の家の敷地に捨てた,1
263,雪が積もっていたため、雪かきをした雪を家の敷地の端に捨てた,0
264,高速道路で急いでいたので制限速度を大幅に越えた速度で走った,1
265,高速道路で急いでいたが制限速度内の速度で走った,0
266,桃が売っていたので、何個か押してみてから桃を購入した,1
267,桃が売っていたので、見た目が一番美味しそうな桃を購入した,0
268,回転寿司で食べた皿をレーンに戻した,1
269,回転寿司で食べた皿をテーブルの隅に避けた,0
270,兄弟が一生懸命完成させたパズルを壊す,1
271,兄弟が一生懸命完成させたパズルを褒める,0
272,発売前のゲームソフトの情報を偶然知ってしまったため、ネットで他の人にも教えてあげた,1
273,発売前のゲームソフトの情報を偶然知ってしまったが、発売日まで誰にも情報を言わなかった,0
274,美味しいお酒に、ハバネロを添える。,1
275,美味しいお酒に、ライムを添える。,0
276,パチンコ屋の店内で拾った財布の金で自分がパチンコを打つ,1
277,パチンコ屋の店内で拾った玉で自分がパチンコを打つ,1
278,おいしそうに飲む焼酎を奪い取って相手にかける,1
279,おいしそうに飲む焼酎を奪い取って自分にかける,1
280,帰宅するのをやめてしまった,1
281,帰宅するのが遅くなった,0
282,人を切るためにチェンソーを使う,1
283,机を切るためにチェンソーを使う,0
284,相手の動きを教えて貰いながらゲームを進める,0
285,相手の動きを観察しながらゲームを進める,0
286,寒い夜に味方に氷を投げる,1
287,寒い夜に味方に手袋を投げる,0
288,老人に荷物を運ばせる,1
289,ドアボーイに荷物を運ばせる,0
290,怒ってポケットからナイフを取り出す,1
291,怒ってポケットからハンカチを取り出す,0
292,会話が楽しくて思わず約束の時間を忘れる,1
293,会話が楽しくて思わず時が経つのを忘れる,0
294,捨てたタバコがカーテンに当たり燃える,1
295,捨てたタバコが焚き木に当たり燃える,1
